{
  "schema_version": "1.0",
  "adventure_id": "The_Harbor_Light_Signal",
  "play_modes": [
    "single_investigator"
  ],
  "investigation_core_links": {
    "package_path": "DO_NOT_READ/investigation_core_package.json"
  },
  "object_interaction_links": {
    "package_path": "DO_NOT_READ/object_interaction_package.json"
  },
  "npc_investigation_links": {
    "package_path": "DO_NOT_READ/npc_investigation_package.json"
  },
  "environment_links": {
    "package_path": "DO_NOT_READ/environment_package.json"
  },
  "modifier_sources": [
    {
      "modifier_id": "MOD-PERCEPTION",
      "capability_category": "perception_observation",
      "source": "character_sheet.perception"
    },
    {
      "modifier_id": "MOD-REASONING",
      "capability_category": "reasoning_analysis",
      "source": "character_sheet.reasoning"
    },
    {
      "modifier_id": "MOD-TECHNICAL",
      "capability_category": "technical_systems",
      "source": "character_sheet.technical"
    }
  ],
  "resolution_model": {
    "formula": "d20 + character_modifier",
    "success_when": "result >= dc"
  },
  "difficulty_bands": {
    "easy": 5,
    "medium": 10,
    "hard": 15
  },
  "destination_units": [
    {
      "unit_id": "UNIT-CHK-RAILING-DECL",
      "player_text": "Make your check."
    },
    {
      "unit_id": "UNIT-RAILING-SUCCESS",
      "player_text": "Success."
    },
    {
      "unit_id": "UNIT-RAILING-FAIL",
      "player_text": "Failure.",
      "hints_missed_content": false,
      "reveals_hidden_object": false
    },
    {
      "unit_id": "UNIT-CHK-LOG-DECL",
      "player_text": "Make your check."
    },
    {
      "unit_id": "UNIT-LOG-SUCCESS",
      "player_text": "Success."
    },
    {
      "unit_id": "UNIT-LOG-FAIL",
      "player_text": "Failure.",
      "hints_missed_content": false,
      "reveals_hidden_object": false
    },
    {
      "unit_id": "UNIT-CHK-RADIO-DECL",
      "player_text": "Make your check."
    },
    {
      "unit_id": "UNIT-RADIO-SUCCESS",
      "player_text": "Success."
    },
    {
      "unit_id": "UNIT-RADIO-FAIL",
      "player_text": "Failure.",
      "hints_missed_content": false,
      "reveals_hidden_object": false
    }
  ],
  "checks": [
    {
      "check_id": "CHK-RAILING",
      "parent_action_id": "ACT-GALLERY-RAILING",
      "parent_action_layer": "object_interaction",
      "parent_action_type": "search",
      "player_action_label": "Examine the gallery railing closely.",
      "capability": "perception",
      "capability_category": "perception_observation",
      "modifier_source_id": "MOD-PERCEPTION",
      "dc": 12,
      "dc_justification": "Careful observation required",
      "why_check_exists": "Reveal hidden detail",
      "success_enables": "Additional knowledge",
      "failure_consequence": "Alternate route available",
      "alternate_route_exists": true,
      "attempt_policy": {
        "default": "one_attempt"
      },
      "time_cost_minutes": 2,
      "cost_applied_once": true,
      "cost_applied_count": 1,
      "eligibility": {
        "single_investigator": "active_investigator",
        "two_player": "role_or_scene"
      },
      "fixed_truth_invariants": {
        "changes_evidence_existence": false,
        "changes_document_contents": false,
        "changes_fixed_truth": false,
        "changes_npc_fixed_knowledge": false
      },
      "destinations": {
        "action_unit_id": "UNIT-CHK-RAILING-DECL",
        "success_destination": "UNIT-RAILING-SUCCESS",
        "failure_destination": "UNIT-RAILING-FAIL"
      },
      "success_effects": {
        "grants_knowledge_ids": [
          "KNOW-RAIL-DAMAGE"
        ],
        "npc_social_effects": []
      },
      "failure_effects": {
        "npc_social_effects": []
      },
      "information_trace": {
        "fixed_truth_ref": "FACT-010",
        "source_id": "OBJ-GALLERY-RAILING"
      }
    },
    {
      "check_id": "CHK-LOG",
      "parent_action_id": "ACT-LOG-BOOK",
      "parent_action_layer": "object_interaction",
      "parent_action_type": "interpret",
      "player_action_label": "Analyze the log discrepancy.",
      "capability": "reasoning",
      "capability_category": "reasoning_interpretation",
      "modifier_source_id": "MOD-REASONING",
      "dc": 11,
      "dc_justification": "Careful observation required",
      "why_check_exists": "Reveal hidden detail",
      "success_enables": "Additional knowledge",
      "failure_consequence": "Alternate route available",
      "alternate_route_exists": true,
      "attempt_policy": {
        "default": "one_attempt"
      },
      "time_cost_minutes": 2,
      "cost_applied_once": true,
      "cost_applied_count": 1,
      "eligibility": {
        "single_investigator": "active_investigator",
        "two_player": "role_or_scene"
      },
      "fixed_truth_invariants": {
        "changes_evidence_existence": false,
        "changes_document_contents": false,
        "changes_fixed_truth": false,
        "changes_npc_fixed_knowledge": false
      },
      "destinations": {
        "action_unit_id": "UNIT-CHK-LOG-DECL",
        "success_destination": "UNIT-LOG-SUCCESS",
        "failure_destination": "UNIT-LOG-FAIL"
      },
      "success_effects": {
        "grants_knowledge_ids": [
          "KNOW-LOG-DEPARTURE-LINE"
        ],
        "npc_social_effects": []
      },
      "failure_effects": {
        "npc_social_effects": []
      },
      "information_trace": {
        "fixed_truth_ref": "FACT-005",
        "source_id": "OBJ-LOG-BOOK"
      }
    },
    {
      "check_id": "CHK-RADIO",
      "parent_action_id": "ACT-RADIO-TERMINAL",
      "parent_action_layer": "object_interaction",
      "parent_action_type": "operate",
      "player_action_label": "Decode the radio log timestamps.",
      "capability": "technical",
      "capability_category": "technical_operation",
      "modifier_source_id": "MOD-TECHNICAL",
      "dc": 12,
      "dc_justification": "Careful observation required",
      "why_check_exists": "Reveal hidden detail",
      "success_enables": "Additional knowledge",
      "failure_consequence": "Alternate route available",
      "alternate_route_exists": true,
      "attempt_policy": {
        "default": "one_attempt"
      },
      "time_cost_minutes": 2,
      "cost_applied_once": true,
      "cost_applied_count": 1,
      "eligibility": {
        "single_investigator": "active_investigator",
        "two_player": "role_or_scene"
      },
      "fixed_truth_invariants": {
        "changes_evidence_existence": false,
        "changes_document_contents": false,
        "changes_fixed_truth": false,
        "changes_npc_fixed_knowledge": false
      },
      "destinations": {
        "action_unit_id": "UNIT-CHK-RADIO-DECL",
        "success_destination": "UNIT-RADIO-SUCCESS",
        "failure_destination": "UNIT-RADIO-FAIL"
      },
      "success_effects": {
        "grants_knowledge_ids": [
          "KNOW-RADIO-DEPARTURE"
        ],
        "npc_social_effects": []
      },
      "failure_effects": {
        "npc_social_effects": []
      },
      "information_trace": {
        "fixed_truth_ref": "FACT-006",
        "source_id": "OBJ-RADIO-TERMINAL"
      }
    }
  ]
}
