{
  "schema_version": "1.0",
  "adventure_id": "sim_v2_two_player",
  "play_modes": [
    "two_player"
  ],
  "investigation_core_links": {
    "package_path": "DO_NOT_READ/investigation_core_package.json"
  },
  "object_interaction_links": {
    "package_path": "DO_NOT_READ/object_interaction_package.json"
  },
  "npc_investigation_links": {
    "package_path": "DO_NOT_READ/npc_investigation_package.json"
  },
  "modifier_sources": [
    {
      "modifier_id": "MOD-PERCEPTION",
      "capability_category": "perception_observation",
      "source": "character_sheet.perception"
    }
  ],
  "resolution_model": {
    "formula": "d20 + character_modifier",
    "success_when": "result >= dc"
  },
  "difficulty_bands": {
    "easy": 5,
    "medium": 10,
    "hard": 15
  },
  "destination_units": [
    {
      "unit_id": "UNIT-CHK-DECL",
      "player_text": "Search carefully.",
      "exposes_success_content": false,
      "exposes_failure_content": false
    },
    {
      "unit_id": "UNIT-SUCCESS",
      "player_text": "You notice fresh scuff marks."
    },
    {
      "unit_id": "UNIT-FAIL",
      "player_text": "You find nothing useful."
    }
  ],
  "checks": [
    {
      "check_id": "CHK-OBS-SCUff",
      "parent_action_id": "ACT-SEARCH-DESK",
      "parent_action_layer": "object_interaction",
      "parent_action_type": "search",
      "player_action_label": "Search the desk carefully.",
      "capability": "perception",
      "capability_category": "perception_observation",
      "modifier_source_id": "MOD-PERCEPTION",
      "dc": 10,
      "dc_justification": "Hidden scuff requires careful observation",
      "why_check_exists": "Reveal observation knowledge",
      "success_enables": "Scuff mark knowledge",
      "failure_consequence": "Miss observation; alternate route via testimony",
      "alternate_route_exists": true,
      "attempt_policy": {
        "default": "one_attempt"
      },
      "time_cost_minutes": 2,
      "cost_applied_once": true,
      "cost_applied_count": 1,
      "eligibility": {
        "single_investigator": "active_investigator",
        "two_player": "role_or_scene"
      },
      "fixed_truth_invariants": {
        "changes_evidence_existence": false,
        "changes_document_contents": false,
        "changes_fixed_truth": false,
        "changes_npc_fixed_knowledge": false
      },
      "destinations": {
        "action_unit_id": "UNIT-CHK-DECL",
        "success_destination": "UNIT-SUCCESS",
        "failure_destination": "UNIT-FAIL"
      },
      "success_effects": {
        "grants_knowledge_ids": [
          "KNOW-001"
        ],
        "npc_social_effects": []
      },
      "failure_effects": {
        "npc_social_effects": []
      },
      "information_trace": {
        "fixed_truth_ref": "WF-001",
        "source_layer": "observation",
        "source_id": "OBS-001",
        "observation_id": "OBS-001"
      }
    }
  ]
}